{
  "$schema": "https://json-schema.org/draft/2020-12/schema",
  "$id": "https://github.com/0xfanbase/Bitcoin-Engine-Room/pipeline/schemas/scenario_forecast.schema.json",
  "type": "object",
  "required": ["schema_version", "generated_at", "as_of", "spot", "method", "horizons", "fan", "ensemble", "learning", "history"],
  "properties": {
    "schema_version": { "type": "integer", "minimum": 2 },
    "generated_at": { "type": "string" },
    "as_of": { "type": "string" },
    "spot": { "type": "number" },
    "method": { "type": "object" },
    "horizons": {
      "type": "array",
      "minItems": 5,
      "items": {
        "type": "object",
        "required": ["id", "label", "days", "target_date", "p10", "p50", "p90", "in_live_ledger"]
      }
    },
    "history": { "type": "array" },
    "fan": { "type": "array", "minItems": 10 },
    "ensemble": {
      "type": "array",
      "minItems": 1,
      "items": {
        "type": "object",
        "required": ["id", "name", "role", "trust_note"],
        "not": { "required": ["share"] }
      }
    },
    "learning": { "type": "object" }
  },
  "additionalProperties": true
}
