{
  "schema_version": 3,
  "generated_at": "2026-10-27T12:35:05Z",
  "as_of": "2026-10-27",
  "spot": 80117.0,
  "method": {
    "family": "power_law_ar1_conformal",
    "a": -16.193198,
    "b": 5.597099,
    "genesis_date": "2009-01-03",
    "fit_start_date": "2010-07-17",
    "residual_quantiles": {
      "p10": -0.326143,
      "p50": -0.06196,
      "p90": 0.435424
    },
    "n_residuals": 5915,
    "ar1": {
      "sample_days": 30,
      "phi": 0.887324,
      "innov_sigma": 0.13816,
      "half_life_days": 173.9,
      "r0": -0.246574
    },
    "width": {
      "rule": "\u22644y: walk-forward conformal P10/P90 of AR1-relative log errors; 10y/30y: Idle/Redline corridor around Cruise; fan tapers 4y\u219210y",
      "conformal": {
        "30": {
          "horizon_days": 30,
          "n_origins": 165,
          "approx_independent_windows": 167.2,
          "offset_lo": -0.115852,
          "offset_hi": 0.13401,
          "width": 0.249862,
          "err_p50": -0.021294
        },
        "90": {
          "horizon_days": 90,
          "n_origins": 163,
          "approx_independent_windows": 55.1,
          "offset_lo": -0.247926,
          "offset_hi": 0.271967,
          "width": 0.519893,
          "err_p50": -0.046042
        },
        "180": {
          "horizon_days": 180,
          "n_origins": 160,
          "approx_independent_windows": 27.0,
          "offset_lo": -0.352804,
          "offset_hi": 0.365652,
          "width": 0.718456,
          "err_p50": -0.063533
        },
        "365": {
          "horizon_days": 365,
          "n_origins": 154,
          "approx_independent_windows": 12.8,
          "offset_lo": -0.527524,
          "offset_hi": 0.419084,
          "width": 0.946608,
          "err_p50": -0.088705
        },
        "730": {
          "horizon_days": 730,
          "n_origins": 142,
          "approx_independent_windows": 5.9,
          "offset_lo": -0.596519,
          "offset_hi": 0.250589,
          "width": 0.847108,
          "err_p50": -0.118243
        },
        "1461": {
          "horizon_days": 1461,
          "n_origins": 118,
          "approx_independent_windows": 2.5,
          "offset_lo": -0.447861,
          "offset_hi": 0.30111,
          "width": 0.748971,
          "err_p50": -0.118277
        }
      },
      "ultra_long": {
        "source": "models.power_law.bands.outer_offsets_log10",
        "offset_lo": -0.394066,
        "offset_hi": 0.722522
      },
      "replaced": "sqrt_years_scale_from_v2"
    },
    "ledger_horizons_days": [
      30,
      90,
      365,
      730,
      1461
    ],
    "closed_loop": {
      "status": "inactive_waiting_for_matured",
      "n_matured_total": 0,
      "pooled": {
        "n": 0,
        "bias_log10": 0.0,
        "widen_log10": 0.0
      },
      "note_path": "pipeline/notes/FORECAST_CLOSED_LOOP_V1.md"
    },
    "disclaimer": "P50 mean-reverts toward Cruise via AR(1) (same family as Models short-term). P10/P90 for \u22644y are walk-forward conformal envelopes of AR1 forecast errors \u2014 empirical coverage targets, NOT confidence intervals (independent windows are small). When enough ledger calls have matured, a shrunk/capped closed-loop bias (and optional band widen) nudges \u22644y forecasts from published\u2192outcome misses; this is still not a CI. 10y/30y use the Models Idle/Redline corridor as a scenario ribbon only. Live ledger freezes 30d/90d/1y/2y/4y.",
    "note_path": "pipeline/notes/FORECAST_CALIBRATION_V3.md"
  },
  "horizons": [
    {
      "id": "1m",
      "label": "1 month",
      "days": 30,
      "target_date": "2026-11-26",
      "p10": 67117.91,
      "p50": 87637.59,
      "p90": 119316.47,
      "cruise": 145037.81,
      "multiple_vs_spot_p50": 1.094,
      "log_width": 0.2499,
      "offset_lo": -0.115852,
      "offset_hi": 0.13401,
      "residual_mean": -0.218791,
      "closed_loop_bias": 0.0,
      "closed_loop_widen": 0.0,
      "closed_loop_source": "identity",
      "band_source": "conformal@30d",
      "conformal_n_origins": 165,
      "conformal_indep_windows": 167.2,
      "in_live_ledger": true,
      "caveat": null
    },
    {
      "id": "1y",
      "label": "1 year",
      "days": 365,
      "target_date": "2027-10-27",
      "p10": 49874.32,
      "p50": 168035.48,
      "p90": 441047.12,
      "cruise": 191859.15,
      "multiple_vs_spot_p50": 2.097,
      "log_width": 0.9466,
      "offset_lo": -0.527524,
      "offset_hi": 0.419084,
      "residual_mean": -0.057582,
      "closed_loop_bias": 0.0,
      "closed_loop_widen": 0.0,
      "closed_loop_source": "identity",
      "band_source": "conformal@365d",
      "conformal_n_origins": 154,
      "conformal_indep_windows": 12.8,
      "in_live_ledger": true,
      "caveat": null
    },
    {
      "id": "2y",
      "label": "2 years",
      "days": 730,
      "target_date": "2028-10-26",
      "p10": 62926.23,
      "p50": 248513.91,
      "p90": 442526.92,
      "cruise": 256328.87,
      "multiple_vs_spot_p50": 3.102,
      "log_width": 0.8471,
      "offset_lo": -0.596519,
      "offset_hi": 0.250589,
      "residual_mean": -0.013447,
      "closed_loop_bias": 0.0,
      "closed_loop_widen": 0.0,
      "closed_loop_source": "identity",
      "band_source": "conformal@730d",
      "conformal_n_origins": 142,
      "conformal_indep_windows": 5.9,
      "in_live_ledger": true,
      "caveat": null
    },
    {
      "id": "4y",
      "label": "4 years",
      "days": 1461,
      "target_date": "2030-10-27",
      "p10": 156366.57,
      "p50": 438535.66,
      "p90": 877232.91,
      "cruise": 439273.82,
      "multiple_vs_spot_p50": 5.474,
      "log_width": 0.749,
      "offset_lo": -0.447861,
      "offset_hi": 0.30111,
      "residual_mean": -0.00073,
      "closed_loop_bias": 0.0,
      "closed_loop_widen": 0.0,
      "closed_loop_source": "identity",
      "band_source": "conformal@1461d",
      "conformal_n_origins": 118,
      "conformal_indep_windows": 2.5,
      "in_live_ledger": true,
      "caveat": null
    },
    {
      "id": "10y",
      "label": "10 years",
      "days": 3652,
      "target_date": "2036-10-26",
      "p10": 690618.51,
      "p50": 1711213.58,
      "p90": 9032879.5,
      "cruise": 1711213.58,
      "multiple_vs_spot_p50": 21.359,
      "log_width": 1.1166,
      "offset_lo": -0.394066,
      "offset_hi": 0.722522,
      "residual_mean": 0.0,
      "closed_loop_bias": 0.0,
      "closed_loop_widen": 0.0,
      "closed_loop_source": "identity",
      "band_source": "idle_redline_corridor",
      "conformal_n_origins": null,
      "conformal_indep_windows": null,
      "in_live_ledger": false,
      "caveat": "Scenario only \u2014 corridor is Models Idle/Redline (empirical residual envelope), not a walk-forward-calibrated CI. Independent sample at this horizon is effectively zero."
    },
    {
      "id": "30y",
      "label": "30 years",
      "days": 10957,
      "target_date": "2056-10-26",
      "p10": 14331617.07,
      "p50": 35510860.45,
      "p90": 187449029.24,
      "cruise": 35510860.45,
      "multiple_vs_spot_p50": 443.238,
      "log_width": 1.1166,
      "offset_lo": -0.394066,
      "offset_hi": 0.722522,
      "residual_mean": 0.0,
      "closed_loop_bias": 0.0,
      "closed_loop_widen": 0.0,
      "closed_loop_source": "identity",
      "band_source": "idle_redline_corridor",
      "conformal_n_origins": null,
      "conformal_indep_windows": null,
      "in_live_ledger": false,
      "caveat": "Scenario only \u2014 corridor is Models Idle/Redline (empirical residual envelope), not a walk-forward-calibrated CI. Independent sample at this horizon is effectively zero."
    }
  ],
  "history": [
    {
      "date": "2018-11-04",
      "price": 6361.3
    },
    {
      "date": "2018-11-11",
      "price": 6388.46
    },
    {
      "date": "2018-11-18",
      "price": 5572.44
    },
    {
      "date": "2018-11-25",
      "price": 3862.01
    },
    {
      "date": "2018-12-02",
      "price": 4188.09
    },
    {
      "date": "2018-12-09",
      "price": 3453.66
    },
    {
      "date": "2018-12-16",
      "price": 3231.91
    },
    {
      "date": "2018-12-23",
      "price": 4031.85
    },
    {
      "date": "2018-12-30",
      "price": 3770.36
    },
    {
      "date": "2019-01-06",
      "price": 3831.94
    },
    {
      "date": "2019-01-13",
      "price": 3637.31
    },
    {
      "date": "2019-01-20",
      "price": 3703.98
    },
    {
      "date": "2019-01-27",
      "price": 3576.3
    },
    {
      "date": "2019-02-03",
      "price": 3506.22
    },
    {
      "date": "2019-02-10",
      "price": 3664.38
    },
    {
      "date": "2019-02-17",
      "price": 3619.55
    },
    {
      "date": "2019-02-24",
      "price": 4139.6
    },
    {
      "date": "2019-03-03",
      "price": 3831.44
    },
    {
      "date": "2019-03-10",
      "price": 3950.56
    },
    {
      "date": "2019-03-17",
      "price": 4015.95
    },
    {
      "date": "2019-03-24",
      "price": 4011.92
    },
    {
      "date": "2019-03-31",
      "price": 4114.44
    },
    {
      "date": "2019-04-07",
      "price": 5053.52
    },
    {
      "date": "2019-04-14",
      "price": 5064.62
    },
    {
      "date": "2019-04-21",
      "price": 5309.28
    },
    {
      "date": "2019-04-28",
      "price": 5280.19
    },
    {
      "date": "2019-05-05",
      "price": 5771.08
    },
    {
      "date": "2019-05-12",
      "price": 7248.31
    },
    {
      "date": "2019-05-19",
      "price": 7265.05
    },
    {
      "date": "2019-05-26",
      "price": 8071.45
    },
    {
      "date": "2019-06-02",
      "price": 8554.8
    },
    {
      "date": "2019-06-09",
      "price": 7931.34
    },
    {
      "date": "2019-06-16",
      "price": 8859.47
    },
    {
      "date": "2019-06-23",
      "price": 10668.63
    },
    {
      "date": "2019-06-30",
      "price": 11890.38
    },
    {
      "date": "2019-07-07",
      "price": 11232.04
    },